{
  "envelopeVersion": "1",
  "messageId": "11111111-2222-3333-4444-555555555555",
  "correlationId": "33333333-4444-5555-6666-777777777777",
  "destinationAddress": "queue:golden-destination",
  "messageType": [
    "conveyo:golden.invoice-posted.v2",
    "conveyo:golden.invoice-posted"
  ],
  "message": {
    "invoiceNumber": "INV-2026-0003",
    "status": "posted",
    "customer": {
      "customerId": "CUST-77",
      "displayName": "Grace Hopper"
    }
  },
  "sentTime": "2026-05-14T12:34:56.789Z",
  "headers": null,
  "host": {
    "machineName": "golden-host",
    "processName": "Conveyo.GoldenTests",
    "conveyoVersion": "0.0.0-golden",
    "operatingSystemVersion": "Unix 6.1.0",
    "runtime": "dotnet",
    "runtimeVersion": "10.0.0"
  }
}
